Task name,Idempotency,Version specific installation,Outdated dependencies,Missing dependencies,Assumption about environment,Hardware specific commands,Broken Dependency
Ensure journald configuration directory is present,Task changes the state of the file without checking.,None,None,"
Task is using absolute path for source path","None 


","










































































































",Task did not check the correctness of execution.
Task name,Idempotency,Version specific installation,Outdated dependencies,Missing dependencies,Assumption about environment,Hardware specific commands,Broken Dependency
Ensure journald is configured,None,None,None,None,"None 


","










































































































",Task did not check the correctness of execution.
