Task name,Idempotency,Version specific installation,Outdated dependencies,Missing dependencies,Assumption about environment,Hardware specific commands,Broken Dependency
Open Tang Communication Port {{ tang_server_port }},None,None,None,None,"None 



task uses a software specific command.","
































































































































































",Task did not check the correctness of execution.
Task name,Idempotency,Version specific installation,Outdated dependencies,Missing dependencies,Assumption about environment,Hardware specific commands,Broken Dependency
Override tang server configuration define one port,None,None,None,None,"None 






","






















































































































































































































","Task uses a fixed ID which can become outdated or incorrect across platforms.
Task did not check the correctness of execution."
