Task name,Idempotency,Version specific installation,Outdated dependencies,Missing dependencies,Assumption about environment,Hardware specific commands,Broken Dependency
Windows | Install puppet-agent from Puppetlabs reposiroty,Task violates idempotency because it installs or upgrades packages.,None,None,None,"Task assume the environment is windows. 


","










































































































","Task uses a fixed ID which can become outdated or incorrect across platforms.
Task did not check the correctness of execution."
Task name,Idempotency,Version specific installation,Outdated dependencies,Missing dependencies,Assumption about environment,Hardware specific commands,Broken Dependency
Windows | Puppet-agent service,Task violates idempotency because it executes a command.,None,None,None,"Task assume the environment is windows. 


","










































































































",Task did not check the correctness of execution.
