Task name,Idempotency,Version specific installation,Outdated dependencies,Missing dependencies,Assumption about environment,Hardware specific commands,Broken Dependency
Find old mariadb backup archives,None,None,None,None,"None 




","
































































































































































",Task did not check the correctness of execution.
Task name,Idempotency,Version specific installation,Outdated dependencies,Missing dependencies,Assumption about environment,Hardware specific commands,Broken Dependency
Delete old mariadb backup archives,Task changes the state of the file without checking.,None,None,"
Task is using relative path for source path","None 




","
































































































































































",Task did not check the correctness of execution.
