Task name,Idempotency,Version specific installation,Outdated dependencies,Missing dependencies,Assumption about environment,Hardware specific commands,Broken Dependency
Fetch ceph keys from the first monitor node,Task violates idempotency because it executes a command.,None,None,None,"None 




","






















































































































































































































",Task did not check the correctness of execution.
Task name,Idempotency,Version specific installation,Outdated dependencies,Missing dependencies,Assumption about environment,Hardware specific commands,Broken Dependency
Copy ceph keys to the configuration repository,Task violates idempotency because it executes a command.,None,None,None,"None 

Task uses a docker command that may not be portable.





","












































































































































































































































































","Task uses a fixed ID which can become outdated or incorrect across platforms.
Task did not check the correctness of execution."
