Task name,Idempotency,Version specific installation,Outdated dependencies,Missing dependencies,Assumption about environment,Hardware specific commands,Broken Dependency
Create id_operator.rsa file,Task changes the state of the file without checking.,None,None,"
","None 


","










































































































","Task uses a fixed ID which can become outdated or incorrect across platforms.
Task did not check the correctness of execution."
