Task name,Idempotency,Version specific installation,Outdated dependencies,Missing dependencies,Assumption about environment,Hardware specific commands,Broken Dependency
Task 1,"Task violates idempotency because it creates a user without checking the existence.
Task changes the state of the file without checking.",None,None,"
","None 








","












































































































































































































































































",Task did not check the correctness of execution.
