Task name,Idempotency,Version specific installation,Outdated dependencies,Missing dependencies,Assumption about environment,Hardware specific commands,Broken Dependency
Clean custom user : Systemd : Remove overrides,None,None,None,"
Task is using relative path for source path","None 














","














































































































































































































































































































































































































































","Task uses a fixed ID which can become outdated or incorrect across platforms.
Task did not check the correctness of execution."
