Task name,Idempotency,Version specific installation,Outdated dependencies,Missing dependencies,Assumption about environment,Hardware specific commands,Broken Dependency
Ensure testing trust is absent,None,None,None,None,"None 

task uses a software specific command.","










































































































",Task did not check the correctness of execution.
Task name,Idempotency,Version specific installation,Outdated dependencies,Missing dependencies,Assumption about environment,Hardware specific commands,Broken Dependency
Ensure testing idranges are absent,None,None,None,None,"None 

task uses a software specific command.","










































































































","Task uses a fixed ID which can become outdated or incorrect across platforms.
Task did not check the correctness of execution."
Task name,Idempotency,Version specific installation,Outdated dependencies,Missing dependencies,Assumption about environment,Hardware specific commands,Broken Dependency
Remove dns forward zone,None,None,None,None,"None 

task uses a software specific command.

","
































































































































































",None
