Task name,Idempotency,Version specific installation,Outdated dependencies,Missing dependencies,Assumption about environment,Hardware specific commands,Broken Dependency
Copy public key file to server.,Task changes the state of the file without checking.,None,None,"Task is using relative path for source
","None 


","










































































































",Task did not check the correctness of execution.
Task name,Idempotency,Version specific installation,Outdated dependencies,Missing dependencies,Assumption about environment,Hardware specific commands,Broken Dependency
Ensure asymmetric vault exists with public key from file.,None,None,None,None,"None 

task uses a software specific command.","










































































































",Task did not check the correctness of execution.
Task name,Idempotency,Version specific installation,Outdated dependencies,Missing dependencies,Assumption about environment,Hardware specific commands,Broken Dependency
Remove public key file from server.,None,None,None,"
Task is using relative path for source path","None 


","










































































































",Task did not check the correctness of execution.
