Task name,Idempotency,Version specific installation,Outdated dependencies,Missing dependencies,Assumption about environment,Hardware specific commands,Broken Dependency
oom_score_adjust | create folder,Task changes the state of the file without checking.,None,None,"
Task is using absolute path for source path","None 






","






















































































































































































































",Task did not check the correctness of execution.
Task name,Idempotency,Version specific installation,Outdated dependencies,Missing dependencies,Assumption about environment,Hardware specific commands,Broken Dependency
oom_score_adjust | add the overriding file,None,None,None,None,"None 






","






















































































































































































































","Task uses a fixed ID which can become outdated or incorrect across platforms.
Task did not check the correctness of execution."
